"Low-carbon Economic Dispatching for Integrated Energy System Based on Coordinated Optimization of Power to Gas and Carbon Capture Power Plant","S. REN; J. WANG; X. GONG; L. GONG; X. Peng; J. Ao","School of Electrical and Information Engineering, Changsha University of Science and Technology, Changsha, China; School of Electrical and Information Engineering, Changsha University of Science and Technology, Changsha, China; School of Electrical and Information Engineering, Changsha University of Science and Technology, Changsha, China; School of Electrical and Information Engineering, Changsha University of Science and Technology, Changsha, China; School of Electrical and Information Engineering, Changsha University of Science and Technology, Changsha, China; School of Electrical and Information Engineering, Changsha University of Science and Technology, Changsha, China",2019 IEEE 3rd Conference on Energy Internet and Energy System Integration (EI2),"9 Apr 2020","2019","","","39","43","The rise of power to gas technology provides an effective way for absorption of wind power and low-carbon power. In the carbon capture power plant, CO2 emitted by generating units can be recycled and used in the energy conversion process of power to gas. Thus, the efficient utilization of CO2 can be realized. In view of the serious phenomenon of wind abandonment and high CO2 emissions, a low-carbon economic dispatching model of the integrated energy system based on power to gas and carbon capture power plants is proposed, which takes the power to gas and carbon capture power plants as a whole. The modified IEEE39-bus power network and Belgium 20-bus natural gas network are used for the example analysis. By comparing and analyzing the abandoned wind power, carbon capture capacity and the integrated operation cost of the system under the two models, it is verified that the model can improve the carbon utilization rate, enhance the ability of wind power accommodation, and reduce CO2 emissions and integrated operation cost.","","978-1-7281-3137-5","10.1109/EI247390.2019.9061966","","https://ieeexplore.ieee.org/stamp/stamp.jsp?arnumber=9061966","power to gas;carbon capture power plants;absorption of wind power;integrated energy system;low-carbon;integrated operation cost","Carbon dioxide;Economics;Wind power generation;Carbon;Natural gas;Analytical models","","10","","16","IEEE","9 Apr 2020","","","IEEE","IEEE Conferences"
"The impact of the coal-gas relative price on the CO2 marginal abatement effect of renewable electricity in the US","F. Michelet","CERNA MINES ParisTech – PSL, Paris, France",2022 18th International Conference on the European Energy Market (EEM),"20 Oct 2022","2022","","","1","5","This paper evaluates the impact of the coal-gas relative price on the CO2 marginal abatement effect of renewable electricity in the US between 2008 and 2020. Using monthly plant level data for over 5500 power plants, we estimate a Heckman two-steps model to capture the decision to operate a plant and the effect of our control variables on emissions conditional on operating. We find that emissions decrease at an increasing rate with the cost ratio, that wind and solar generation decrease also CO2 emissions, and that the interaction effect between relative fuel prices and renewables generation is negative and significant in regions with high wind or high solar penetration. This interaction effect implies that cheaper natural gas relative to coal and greater wind or solar generation levels together lead to a greater reduction in emissions than either factor in isolation.","2165-4093","978-1-6654-0896-7","10.1109/EEM54602.2022.9921069","","https://ieeexplore.ieee.org/stamp/stamp.jsp?arnumber=9921069","Electricity markets;Carbon emissions;Renewable energy;Fuel switching;Merit order effect","Renewable energy sources;Costs;Europe;Coal;Switches;Production;Carbon dioxide","","1","","6","IEEE","20 Oct 2022","","","IEEE","IEEE Conferences"
"Energy-Saving and Economic Analysis of Central Air-Conditioning Upgrading in Thermal Power Plants","C. Yin; W. Li","CHN Energy Baoqing Power Co., Ltd., Shaoyang, China; CHN Energy Hunan Power Co., Ltd., Changsha, China","2024 10th International Conference on Electrical Engineering, Control and Robotics (EECR)","5 Aug 2024","2024","","","370","374","This study examines the HVAC system upgrade at a thermoelectric power plant, focusing on both its administrative and residential buildings. The aim is to replace the existing air-cooled heat pump units with more efficient and reliable lithium bromide units, followed by an economic analysis. Results show a significant reduction in initial investment by 387,000 yuan and operational costs by 386,000 yuan post-renovation. Additionally, electricity consumption in the residential area during the cooling season sees a noteworthy decrease of 432,540 kilowatt-hours annually compared to pre-renovation levels. Through a 15-year lifecycle assessment, it's projected that this upgrade could save 1,420.5 tons of standard coal and cut CO2 emissions by 9,064.5 tons.","","979-8-3503-7000-3","10.1109/EECR60807.2024.10607293","","https://ieeexplore.ieee.org/stamp/stamp.jsp?arnumber=10607293","thermal power plant;lithium bromide unit;economy and energy conservation","Heat pumps;Thermal engineering;Bromine compounds;Lithium;Thermal analysis;Reliability;Power generation","","","","7","IEEE","5 Aug 2024","","","IEEE","IEEE Conferences"
"Multi Objective Low Carbon Economic Dispatch Of Power System Considering Integrated Flexible Operation Of Carbon Capture Power Plant","C. Yang; Z. Cong; D. Guibo; L. Yicheng; Y. Shipeng; S. Zhuo","School of Electrical Engineering, Northeast Electric Power University, Jilin, China; School of Electrical Engineering, Northeast Electric Power University, Jilin, China; School of Electrical Engineering, Northeast Electric Power University, Jilin, China; School of Electrical Engineering, Northeast Electric Power University, Jilin, China; School of Electrical Engineering, Northeast Electric Power University, Jilin, China; School of Electrical Engineering, Northeast Electric Power University, Jilin, China",2021 Power System and Green Energy Conference (PSGEC),"24 Sep 2021","2021","","","321","326","Carbon capture power plant is the key technology to respond to low-carbon economy and realize low-carbon development of power system. However, the static operation mode of carbon capture power plant has the coupling problem of capture and regeneration process, and its low-carbon effect needs to be further improved. In view of the above problems, this paper first deeply excavates the low-carbon and economy of the integrated flexible operation mode of carbon capture power plant, and makes a detailed modeling of the integrated flexible operation mode of carbon capture power plant; Secondly, considering the economic benefits and low carbon level of the system, a day ahead scheduling model with comprehensive cost and overall carbon emission optimization is constructed. Finally, an IEEE-39 bus system is simulated to verify the effectiveness of the proposed scheduling model.","","978-1-7281-9095-2","10.1109/PSGEC51302.2021.9542780","National Natural Science Foundation of China; ","https://ieeexplore.ieee.org/stamp/stamp.jsp?arnumber=9542780","Carbon capture power plant;Integrated flexible operation mode;conserve energy;reduce emissions;low-carbon economy","Couplings;Costs;Carbon dioxide;Low-carbon economy;Wind power generation;Linear programming;Power systems","","13","","11","IEEE","24 Sep 2021","","","IEEE","IEEE Conferences"
"Classification and Quantitative Analysis of Power Generation Costs in Power System","Y. Zhang; C. Shi; J. Zhang; L. Zhang; T. Zhang; M. Zhang","School of Electrical and Information Engineering, Tianjin University, Tianjin, China; College of Science, National University of Defense Technology, Changsha, China; Encha Central Elementary School, The Open University of China, Hengshui, China; Hengshui Teachers' Training School, Hengshui, China; Zhang Xiutun Middle School, Hengshui, China; Hengshui Zhihua Experimental Middle School, Hengshui, China","2024 3rd International Conference on Energy, Power and Electrical Technology (ICEPET)","13 Aug 2024","2024","","","813","816","The generation cost of power system restricts the generation capacity of power generation enterprises. And the size of power generation determines the economic level and quality of life. This paper classifies and summarizes the cost composition of the power generation side of the power system, and divides the power generation cost into three categories: coal consumption cost, carbon emission cost, and start stop cost. Identify the meanings represented by each type of cost and construct mathematical models for each of these costs separately. Based on the load data of Monte Carlo simulation, the power generation data is obtained and the power generation cost is calculated. The proposed calculation method of power generation cost is verified on the IEEE 33 node system.","","979-8-3503-5265-8","10.1109/ICEPET61938.2024.10625844","","https://ieeexplore.ieee.org/stamp/stamp.jsp?arnumber=10625844","Electrical power system;power generation cost;mathematical model;coal consumption","Costs;Monte Carlo methods;Coal;Carbon dioxide;Mathematical models;Data models;Power systems","","","","14","IEEE","13 Aug 2024","","","IEEE","IEEE Conferences"
"Blockchain-based carbon allowance trading market construction","L. Yuan; J. Dong; N. Wang; Z. Chen; G. Gong",NA; NA; NA; NA; NA,2021 IEEE Sustainable Power and Energy Conference (iSPEC),"24 Mar 2022","2021","","","245","248","In order to successfully achieve the goal of “carbon peak and carbon neutrality” and to more effectively promote carbon emission reduction, this article starts from the power industry and proposes a carbon allowance trading scheme based on blockchain technology, To restrict the amount of carbon dioxide produced by thermal power plants, and contribute to the “dual carbon” goal. Users can buy and sell carbon quotas on the platform, and use blockchain technology to protect the security of user transactions, making market transactions more transparent. All transaction information is backed up and stored on all nodes of the blockchain, which is truly Centralized storage.","","978-1-6654-1439-5","10.1109/iSPEC53008.2021.9735453","","https://ieeexplore.ieee.org/stamp/stamp.jsp?arnumber=9735453","Carbon peak;carbon neutrality;carbon emission reduction;blockchain;carbon allowance;decentralization","Conferences;Smart contracts;Carbon dioxide;Power industry;Blockchains;Power systems;Planning","","","","8","IEEE","24 Mar 2022","","","IEEE","IEEE Conferences"
"Research on the optimization scheduling of regional integrated energy systems based on electric-carbon coupling","S. Zhang; X. Xu","School of Business, Shanghai DianJi University, Shanghai, China; School of Business, Shanghai DianJi University, Shanghai, China",2023 10th International Forum on Electrical Engineering and Automation (IFEEA),"15 Feb 2024","2023","","","200","204","To expedite the achievement of goals related to carbon emission peak and carbon neutrality, as well as promote initiatives for reducing emissions, this paper introduces an innovative scheduling scheme designed for integrated energy systems. This scheme investigates the optimal economic operation of the system under the objective of ""carbon neutrality"" by considering the synergistic effects of air capture devices, carbon capture devices, power-to-gas devices, and combined heat and power generation devices while taking into account environmental CO2 absorption. The mathematical models for each unit in the system were established, and MATLAB simulation platform, YALIMIP toolbox, and CPLEX solver were employed to validate the system simulation. The results demonstrate that without a power-to-gas system, the proposed model can reduce costs by 8.84%, whereas without a cogeneration system it can achieve cost reductions of up to 41.70%, while maintaining nearly unchanged electricity-carbon coupling coefficients.","","979-8-3503-0937-9","10.1109/IFEEA60725.2023.10429724","","https://ieeexplore.ieee.org/stamp/stamp.jsp?arnumber=10429724","Integrated energy systems;Air capture system;Carbon capture;Electric-carbon coupling;Electricity to gas","Couplings;Costs;Cogeneration;Carbon dioxide;Carbon neutral;Mathematical models;Optimization","","","","11","IEEE","15 Feb 2024","","","IEEE","IEEE Conferences"
"AI based CO2 and Locational Marginal Emission up to End Users with Energy Mix","A. Saber; M. A. Alam; T. Khandelwal","Optimization & AI Dept., Operation Technology Inc., Irvine, CA, USA; Optimization & AI Dept., Operation Technology Inc., Irvine, CA, USA; T&D Dept. Operation Technology Inc., Irvine, CA, USA",2024 IEEE Power & Energy Society General Meeting (PESGM),"4 Oct 2024","2024","","","1","5","In the pursuit of clean energy goals set by various countries and states for 2030, it is imperative to assess Carbon Emission Flow (CEF) accurately across the entire energy supply chain. This paper introduces an innovative approach employing Artificial Intelligence (AI) techniques to calculate both direct (Scope 1) and indirect (Scope 2) CEF, encompassing power generation, transmission, and end-user consumption. While direct emissions from connected generators can be measured using power generation data, heat rates, and fuel types, indirect emissions from imported/exported power require AI algorithms analyzing historical and real-time data. CEF of an element is the amount of CO2 generated from power sources for the corresponding element. Our methodology computes the total (both direct and indirect) and Locational Marginal Emission (LME) for diverse energy mixes at each node and load in the power network. This approach provides precise, location specific CEF data, allowing identification of nodes with varying carbon intensity. By understanding the emissions landscape, policymakers can develop targeted strategies, facilitating the reduction of carbon emissions and guiding future taxation policies. This innovative AI-driven framework enhances our ability to transition towards a sustainable energy future while meeting clean energy targets.","1944-9933","979-8-3503-8183-2","10.1109/PESGM51994.2024.10688534","","https://ieeexplore.ieee.org/stamp/stamp.jsp?arnumber=10688534","CO2 Footprint;Energy Mix;DER;Locational Marginal Emission;Scope 1/2;Data Driven AI Model","Green energy;Accuracy;Supply chains;Carbon dioxide;Real-time systems;Stakeholders;Artificial intelligence;Waste disposal;Carbon emissions;Power generation","","","","24","IEEE","4 Oct 2024","","","IEEE","IEEE Conferences"
"Low Carbon Optimized Operation of Integrated Energy Systems Counting Solar Thermal Power Plants and Hydrogen Energy Storage","Z. Li; W. Zhang; G. Li; Z. Zhao; Y. Wang; Y. Qin; L. Guo","Economic and Technical Research Institute of State Grid Jiangsu Electric Power Co., Ltd., Jiangsu, China; Economic and Technical Research Institute of State Grid Jiangsu Electric Power Co., Ltd., Jiangsu, China; Economic and Technical Research Institute of State Grid Jiangsu Electric Power Co., Ltd., Jiangsu, China; School of Economics and Management, North China Electric Power University, Beijing, China; School of Economics and Management, North China Electric Power University, Beijing, China; School of Economics and Management, North China Electric Power University, Beijing, China; School of Economics and Management, North China Electric Power University, Beijing, China",2023 3rd International Conference on Energy Engineering and Power Systems (EEPS),"22 Sep 2023","2023","","","326","332","In order to realize the low carbon development under the double carbon background and solve the multi-energy supply and energy saving and emission reduction problems of integrated energy system, a low carbon optimized operation strategy of integrated energy system containing a kind of solar thermal power plant and hydrogen energy storage is proposed. By analyzing the joint operation of TES system and hydrogen energy storage system, a multi-storage joint supply model is established to effectively realize the mutual transfer of electricity-thermal energy, improve energy utilization and optimize the operational flexibility of the system. Carbon trading and carbon tax are introduced into the system decision, and a low-carbon dispatch optimization model of the integrated energy system is constructed with the objective of minimizing the comprehensive costs of energy purchase, operation and maintenance, and carbon trading costs. Finally, different scenarios of operation are analyzed and the optimization model is simulated and analyzed.","","979-8-3503-1385-7","10.1109/EEPS58791.2023.10257104","","https://ieeexplore.ieee.org/stamp/stamp.jsp?arnumber=10257104","Solar thermal power plant;hydrogen storage;integrated energy system;low carbon operation","Analytical models;Hydrogen storage;Costs;Hydrogen;Thermal engineering;Heat engines;Carbon dioxide","","","","12","IEEE","22 Sep 2023","","","IEEE","IEEE Conferences"
"Influence of Carbon Capture Technology Application on the Peak-regulating Capacity of Coal-fired Units","X. Jiang; X. Lei; H. Zhang; F. Yao; X. Yuan; H. Chen","Economic Research Institute, State Grid Liaoning Electric Power Co. Ltd, Shenyang, China; China Energy Engineering Group Shanxi Electric Power Engineering Co., Ltd, China; Economic & Technology Research Institute,State Grid Shandong Electric Power Company, China; State Grid Chongqing Economic Research Institute, Chongqing, China; North China Electric Power University, Beijing, China; North China Electric Power University, Beijing, China",2023 8th Asia Conference on Power and Electrical Engineering (ACPEE),"31 May 2023","2023","","","1372","1378","Coal-fired power plants are by far the largest single source of carbon emissions in the country, and in the context of the ""two-carbon"" target, it is urgent to reduce carbon emissions from coal-fired power plants. At present, CCUS (Carbon capture, Storage and utilization) technology is the only technology that can reduce carbon dioxide emissions of coal-fired power plants on a large scale. At present, the commonly used technology is to install carbon capture devices on the basis of traditional coal-fired power stations to form carbon capture power plants. However, the introduction of carbon capture devices will affect the operation of power plants and peak load control ability. Based on the analysis of the basic principles of different carbon capture technologies, this paper selects a suitable carbon capture scheme based on a typical coal-fired power plant in China. By constructing the simulation models of conventional coal-fired thermal power units and carbon capture power plants, the operation interval of carbon capture power plants is obtained. Meanwhile, the peak regulating performance of power plants installed with carbon capture devices and its influence on the peak regulating capacity of power grids are analyzed.","","979-8-3503-4552-0","10.1109/ACPEE56931.2023.10135670","","https://ieeexplore.ieee.org/stamp/stamp.jsp?arnumber=10135670","CCUS;Coal-fired power plants;Carbon capture power plant;Peak regulation","Performance evaluation;Power supplies;Carbon dioxide;Regulation;Power grids;Carbon;Power generation","","1","","16","IEEE","31 May 2023","","","IEEE","IEEE Conferences"
"Research on Impact of Carbon Emission Reduction on Enterprise Value Based on Multiple Linear Regression Model","Y. Xiong; H. Lin","School of Management, Wuhan University of Science and Technology, Wuhan, China; School of Management, Wuhan University of Science and Technology, Wuhan, China","2023 IEEE 3rd International Conference on Electronic Communications, Internet of Things and Big Data (ICEIB)","7 Jul 2023","2023","","","387","391","The purpose of this study is to discuss the impact of carbon emission reduction on enterprise value and to help enterprises maximize enterprise value while saving energy and reducing emissions. Using case analysis and empirical analysis methods, we construct a multiple linear regression equation using the data of A-share enterprises listed in Shanghai and Shenzhen from 2017 to 2020 in the power, heat production, and supply industries to test the impact of carbon emission reduction on enterprise value. With China Huadian Corporation as an example, we analyze the impact mechanism of carbon emission reduction on enterprise value. Carbon emission reduction can promote enterprises' environmental performance and social reputation. Although enterprises spend a certain amount of cost in the process of carbon emission reduction, technological improvement, and structural optimization can also help enterprises improve resource utilization rate so that enterprises can gain competitive advantages and thus improve their ability to create value. The results show that there is a positive correlation between carbon emission reduction and enterprise value. Enterprises need to pay attention to reducing carbon emissions to achieve a win-win situation of environmental benefits and economic benefits.","","979-8-3503-3386-2","10.1109/ICEIB57887.2023.10170646","","https://ieeexplore.ieee.org/stamp/stamp.jsp?arnumber=10170646","Multiple linear regression model;carbon emission reduction;enterprise value;carbon information disclosure;big climate data","Industries;Linear regression;Carbon dioxide;Production;Data models;Mathematical models;Resource management","","1","","10","IEEE","7 Jul 2023","","","IEEE","IEEE Conferences"
"The Role of Natural Gas Thermal Generation in the Reliability of an Electrical System and the Importance of Electro-Energy Integration for the Energy Transition","A. Oliveira; J. Santos; J. Mello; D. Ramos; V. Nascimento; M. Udaeta; D. M. P. Orozco","Thermal Power Plants Projects, Thymos Energia, São Paulo, Brazil; Strategy & New Business, Thymos Energia, São Paulo, Brazil; Thymos Energia, São Paulo, Brazil; Energy Systems Dept., University of São Paulo, São Paulo, Brazil; Energy Systems Dept., University of São Paulo, São Paulo, Brazil; Energy Systems Dept., University of São Paulo, São Paulo, Brazil; XM S.A E.S.P, Medellín, Colombia",2024 IEEE Technology and Engineering Management Society (TEMSCON LATAM),"24 Oct 2024","2024","","","1","6","The objective of this work is to enhance understanding of the importance of Natural Gas Thermal Power Plants in ensuring the reliability of the National Interconnected System, particularly during the Energy Transition process. This context involves the large-scale integration of Non-Dispatchable Renewable Sources. Furthermore, the aim is to demonstrate how electro-energy integration with Argentina can contribute to this scenario.","","979-8-3503-5431-7","10.1109/TEMSCONLATAM61834.2024.10717653","","https://ieeexplore.ieee.org/stamp/stamp.jsp?arnumber=10717653","Thermal power plants;natural gas;reliability;supply adequacy;energy export;energy import","Renewable energy sources;Engineering management;Thermal engineering;Interconnected systems;Thermal management;Reliability engineering;Large scale integration;Natural gas;Power generation","","","","23","IEEE","24 Oct 2024","","","IEEE","IEEE Conferences"
"Low-carbon Optimization Operation of Integrated Energy System Considering Ladder-type Carbon Trading and Carbon Capture","J. Chen; K. Ning; Q. Zhang; Q. Xu; W. Chen; X. Yu","College of New Energy, China University of Petroleum (Huadong), Qingdao, China; College of New Energy, China University of Petroleum (Huadong), Qingdao, China; Qingdao Ruinengda Electrical Technology Limited Company, Qingdao, China; College of New Energy, China University of Petroleum (Huadong), Qingdao, China; College of New Energy, China University of Petroleum (Huadong), Qingdao, China; College of New Energy, China University of Petroleum (Huadong), Qingdao, China",2022 7th Asia Conference on Power and Electrical Engineering (ACPEE),"1 Jun 2022","2022","","","1916","1921","Integrated energy system (IES) is an ideal method to improve the energy utilization efficiency and cut down the emission of CO2. In this paper, different carbon trading mechanisms are applied to study the advantage of ladder-type carbon trading mechanism. Numerical results show its advancement in carbon emission reduction. Then, generators with different capacity and carbon emission intensity are transformed into carbon capture devices respectively to study the influence of carbon capture in low-carbon economic operation of IES. Results show that generators with large capacity and low carbon emission intensity are more suitable to be transformed into carbon capture device.","","978-1-6654-1819-5","10.1109/ACPEE53904.2022.9784059","","https://ieeexplore.ieee.org/stamp/stamp.jsp?arnumber=9784059","Integrated energy system;Carbon trading;Carbon capture;optimal scheduling","Electrical engineering;Costs;Asia;Power distribution;Carbon dioxide;Generators;Optimization","","5","","10","IEEE","1 Jun 2022","","","IEEE","IEEE Conferences"
