"Low carbon optimal dispatching of power system considering carbon emission flow theory","J. Li; N. Zou; J. Wu; Q. Yang","State Grid Liaoning Electric Power Supply Co. Ltd, Dalian Electric Power Supply Company, Dalian Liaoning, China; State Grid Liaoning Electric Power Supply Co. Ltd, Dalian Electric Power Supply Company, Dalian Liaoning, China; State Grid Liaoning Electric Power Supply Co. Ltd, Dalian Electric Power Supply Company, Dalian Liaoning, China; State Grid Liaoning Electric Power Supply Co. Ltd, Dalian Electric Power Supply Company, Dalian Liaoning, China",2022 9th International Forum on Electrical Engineering and Automation (IFEEA),"10 Feb 2023","2022","","","532","536","In the context of the multiple objectives of carbon peaking, carbon neutral and the construction of modern power systems, how to further achieve the energy saving and emission reduction goals of the system while ensuring the rationality of schedule is an important issue that needs to be addressed. To address the problems that the current research on power scheduling does not integrate the carbon emission flow with the power flow, a low-carbon optimal scheduling method for power systems that took into account the carbon emission flow theory was proposed. Firstly, a carbon emission flow model of the power system was constructed at the equipment level and the system level respectively. Secondly, a bi-level alternating optimal scheduling model, which includes system day-ahead scheduling and load demand response adjustment, was established by considering all aspects of the power system from source-grid-load-storage. Finally, the effectiveness and applicability of the proposed theoretical approach in reducing operating costs and carbon emissions were verified through real-life simulations.","","978-1-6654-6421-5","10.1109/IFEEA57288.2022.10037975","","https://ieeexplore.ieee.org/stamp/stamp.jsp?arnumber=10037975","carbon capture;carbon emission flow;operational scheduling;demand response","Electrical engineering;Schedules;Costs;Carbon dioxide;Optimal scheduling;Demand response;Dispatching","","1","","12","IEEE","10 Feb 2023","","","IEEE","IEEE Conferences"
"Research on power expansion planning under low carbon economy","J. Zhu; M. Wang; B. Sui; H. Wu; K. Fu; Z. Hu","Henan Electric Power Trading Center Co. LTD, Henan Electric Power Trading Center Co. LTD, Zhengzhou, China; Henan Electric Power Trading Center Co. LTD, Henan Electric Power Trading Center Co. LTD, Zhengzhou, China; Henan Electric Power Trading Center Co. LTD, Henan Electric Power Trading Center Co. LTD, Zhengzhou, China; Henan Electric Power Trading Center Co. LTD, Henan Electric Power Trading Center Co. LTD, Zhengzhou, China; Henan Electric Power Trading Center Co. LTD, Henan Electric Power Trading Center Co. LTD, Zhengzhou, China; Henan Electric Power Trading Center Co. LTD, Henan Electric Power Trading Center Co. LTD, Zhengzhou, China",2022 7th Asia Conference on Power and Electrical Engineering (ACPEE),"1 Jun 2022","2022","","","1125","1130","Facing to excessive carbon emissions and global warming, the low carbonization is imperative in the power industry, of which power planning will be one of the most important links. This paper studies the impact of carbon economy on generation expansion planning (GEP) from three aspects of carbon market factor, carbon policy factor and carbon technology and establishes an optimization framework for global power planning and operation under low carbon background. By introducing the factors into the traditional power planning model, this paper establishes a power environmental protection planning model considering the carbon trading and the decommissioning of the original unit. The correctness and rationality of the model is verified by simulation by PSO algorithm. The results show that the power planning model under low carbon economy can effectively guide the power supply structure adjustment, achieve CO2 emission reduction, and meet the needs of current social energy development trend and low carbon economy requirements.","","978-1-6654-1819-5","10.1109/ACPEE53904.2022.9783991","","https://ieeexplore.ieee.org/stamp/stamp.jsp?arnumber=9783991","Carbon economy;power expansion planning;carbon trading;PSO","Schedules;Power supplies;Carbon dioxide;Wind power generation;Power industry;Planning;Trajectory","","2","","13","IEEE","1 Jun 2022","","","IEEE","IEEE Conferences"
"Research and Application of Carbon Emission from Electricity Consumption of Typical Users","Q. Sun; C. Ji; F. Yin; W. Qi; Z. Zhong; H. Su","Smart Grid Service Center, Jiangsu Frontier Electric Power Technology Co., Ltd, Nanjing, China; Smart Grid Service Center, Jiangsu Frontier Electric Power Technology Co., Ltd, Nanjing, China; Smart Grid Service Center, Jiangsu Frontier Electric Power Technology Co., Ltd, Nanjing, China; Smart Grid Service Center, Jiangsu Frontier Electric Power Technology Co., Ltd, Nanjing, China; Smart Grid Service Center, Jiangsu Frontier Electric Power Technology Co., Ltd, Nanjing, China; IOT Technical Consulting Center, Beijing SGITG Accenture Information Technology Center CO., Ltd., Beijjing, China",2021 11th International Conference on Power and Energy Systems (ICPES),"26 Jan 2022","2021","","","662","666","In 2020, China put forward the goal of 2060 carbon neutrality in the general discussion of the United Nations General Assembly. In order to accelerate the realization of the ultimate goal of carbon peak and carbon neutrality, as the main force of China's carbon emission, power enterprises must seek the development path of low-carbon transformation. Based on the real-time data of water, electricity, gas, heat, coal and oil accessed by the platform and the data of users' photovoltaic energy and clean energy, this paper establishes an electric carbon neutrality index algorithm model, carries out carbon emission evaluation, and assists in the evaluation and diagnosis of carbon reduction methods in production processes, Promote typical cases of low-carbon energy consumption, realize customization and carry out comprehensive energy efficiency services.","2767-732X","978-1-6654-1325-1","10.1109/ICPES53652.2021.9683849","","https://ieeexplore.ieee.org/stamp/stamp.jsp?arnumber=9683849","electric power enterprise;carbon emission per kilowatt hour;electric carbon neutrality index","Photovoltaic systems;Energy consumption;Water heating;Carbon dioxide;Production;Real-time systems;Power markets","","","","15","IEEE","26 Jan 2022","","","IEEE","IEEE Conferences"
"Determining the storage capacity for carbon-free generation mix scenario in Spain","J. Fraile-Ardanuy; R. Alvaro-Hermana; J. Merino; S. Castaño-Solis","Information Processing and Telecommunication Center (IPTC-SISDAC), Universidad Politécnica de Madrid, Madrid, Spain; Orkestra-Deusto Foundation, Deusto Business School, University of Deusto, Bilbao, Spain; Smart Grids and Energy Storage Area, Research Alliance (BRTA), Derio, Spain; ETSIDI, Universidad Politécnica de Madrid, Madrid, Spain",2020 IEEE International Conference on Environment and Electrical Engineering and 2020 IEEE Industrial and Commercial Power Systems Europe (EEEIC / I&CPS Europe),"6 Aug 2020","2020","","","1","6","Climate change motivated by human activities constitutes one of the main challenges of this century. To cut carbon emissions to mitigate its dangerous effects, the current energy generation mix should be shifted to renewables sources. The main drawback of these technologies is their intermittency that will require storage systems to fully integrate them in the generation mix, allowing them to be more controllable. In recent years great progress to develop an effective and economically feasible energy storage systems, particularly motivated by the recent rise of demand for electric transportation has been made. Lithium-ion (Li-ion) battery prices have fallen near 90% over the past decade, making possible the affordability of electric vehicles and transforming the economics of renewable energy. In this paper, we evaluate the energy storage requirements for a carbon-free scenario in Spain, analyzing the CO2 emissions reduction.","","978-1-7281-7455-6","10.1109/EEEIC/ICPSEurope49358.2020.9160548","","https://ieeexplore.ieee.org/stamp/stamp.jsp?arnumber=9160548","Battery storage;solar PV;peaking plant;CCGT;coal power plant","Power generation;Batteries;Coal;Transportation;Meteorology;Renewable energy sources;Climate change","","1","","19","IEEE","6 Aug 2020","","","IEEE","IEEE Conferences"
"Measurement of User-Side Carbon Emissions by Carbon Flow Tracking Method Considering Power Supply Path","F. Ma; L. Ying; X. Cui; Q. Yu; G. You; P. Sun","State Key Laboratory of Power System Environmental Protection, Wuhan University, Wuhan, China; State Key Laboratory of Power System Environmental Protection, Wuhan University, Wuhan, China; State Key Laboratory of Power System Environmental Protection, Wuhan University, Wuhan, China; Research Center for Power Grid Planning and Construction Yunnan Power Grid Co. LTD, Yunnan, China; Research Center for Power Grid Planning and Construction Yunnan Power Grid Co. LTD, Yunnan, China; Research Center for Power Grid Planning and Construction Yunnan Power Grid Co. LTD, Yunnan, China",2023 2nd Asian Conference on Frontiers of Power and Energy (ACFPE),"11 Mar 2024","2023","","","591","597","Electric power industry plays an important role in energy consumption and carbon emission in China. The balance characteristic of “generation and energy use” of power system determines that the important task of carbon emission reduction needs the coordination of source and network load. Therefore, the measurement of carbon emissions should include direct carbon emissions at the source side and indirect carbon emissions at the grid side and load side. This paper aims to completely describe the power supply process of each power supply to the load with the help of the power supply path, establish a power flow tracking model based on complex power, and then launch a carbon flow tracking model, so as to measure the loss of the transmission and distribution network on the side of the network and the carbon emissions generated by the user’s electricity consumption on the side of the load. The correctness of the proposed carbon flow tracking model is verified by the IEEE39 standard example, and the carbon flow tracking results can provide an important basis for low-carbon power scheduling.","","979-8-3503-0389-6","10.1109/ACFPE59335.2023.10455204","State Grid Corporation of China; ","https://ieeexplore.ieee.org/stamp/stamp.jsp?arnumber=10455204","indirect carbon emission;power supply path;complex power flow tracking;carbon flow tracking;low-carbon power dispatch","Analytical models;Power measurement;Power supplies;Carbon dioxide;Loss measurement;Mathematical models;Task analysis","","","","16","IEEE","11 Mar 2024","","","IEEE","IEEE Conferences"
"Biomass Power Plants in Bosnia and Herzegovina: Potential, Challenges and Economic Analysis","S. Hanjalic; V. Helac; M. Hanjalic; N. Hasanbegovic","Faculty of Electrical Engineering, University of Sarajevo, Sarajevo, Bosnia and Herzegovina; Faculty of Electrical Engineering, University of Sarajevo, Sarajevo, Bosnia and Herzegovina; Faculty of Electrical Engineering, University of Sarajevo, Sarajevo, Bosnia and Herzegovina; International Burch University of Sarajevo, Sarajevo, Bosnia and Herzegovina",2024 20th International Conference on the European Energy Market (EEM),"8 Aug 2024","2024","","","1","4","Energy production is one of the most crucial scientific, technological, economic, and political challenges in today's world. In response to the increasing demands of the European Union for reducing CO2 emissions and mitigating climate change, countries are obligated to align their national energy plans with clearly defined objectives, aiming for climate neutrality by 2050. This paper explores the location potential and optimal implementation of biomass power plants in Bosnia and Herzegovina. Biomass power plants, particularly those utilizing wood and plant biomass, are a promising solution for simultaneously reducing pollution, addressing unnecessary waste, and improving the energy efficiency of the systems where they are installed. The paper concludes that the potential of wood and plant biomass in Bosnia and Herzegovina remains underutilized. From an eco-perspective, the paper will also examine the reuse of large degraded areas in mines, where the fast-growing energy crops like Miscanthus could be planted.","2165-4093","979-8-3503-8174-0","10.1109/EEM60825.2024.10609022","","https://ieeexplore.ieee.org/stamp/stamp.jsp?arnumber=10609022","biomass;biomass power plants;co – generation (CHP);economic analysis","Economics;Pollution;Crops;Europe;Production;Biomass;Fuel processing industries","","","","7","IEEE","8 Aug 2024","","","IEEE","IEEE Conferences"
"Simulation of Multi-objective Low-carbon Economic Scheduling Model Based on Big Data Algorithm","Y. Huang","School of Business, Sanda University, Shanghai, China","2024 Asia-Pacific Conference on Software Engineering, Social Network Analysis and Intelligent Computing (SSAIC)","22 Jul 2024","2024","","","130","135","With the global warming, energy and environmental problems have become increasingly prominent, and the problem of excessive CO2 emission has attracted wide attention from all countries in the world. As a renewable energy, wind power has the characteristics of zero emission and wide sources, but the problem of abandoning wind and absorbing it hinders the development of wind power. Because the quality of scheduling strategy affects the resource utilization rate and job execution efficiency in cloud environment to a great extent, and the jobs scheduled by scheduling algorithms in homogeneous cloud environment are usually independent of each other, which obviously cannot meet the growing and widely used trend of cloud computing, it is very necessary to develop a workflow job scheduling algorithm that can adapt to different resource requirements or depend on each other in large-scale heterogeneous cloud environment. This article first introduces the basic concepts and optimization algorithms of economic dispatch involving wind farms, including the establishment of objective functions and the selection of constraints, commonly used mathematical models for dynamic economic dispatch in power systems, commonly used evolutionary algorithms, and multi-objective optimization models. Finally, a numerical simulation was conducted to analyze the economic benefits and emission reduction effects of using heat storage devices to dissipate wind power in the carbon market environment, as well as the impact of different carbon trading prices on the system’s CO2 emission reduction.","","979-8-3503-9368-2","10.1109/SSAIC61213.2024.00031","","https://ieeexplore.ieee.org/stamp/stamp.jsp?arnumber=10597165","Big data algorithm;Low carbon economy;Scheduling model simulation;Multiple target","Climate change;Big Data;Low carbon economy;Scheduling;Global warming;Wind power generation;Economics;Power system dynamics;Heuristic algorithms;Carbon emissions;Wind farms;Environmental monitoring;Renewable energy sources;Cloud computing;Emissions trading;Pareto optimization","","","","10","IEEE","22 Jul 2024","","","IEEE","IEEE Conferences"
"Energy Block Chain Trading Mechanism Based on Game Strategy","X. Zhou; D. Xu; Y. Ma; F. Tu","School of Electrical Engineering and Automation, Tianjin University of Technology Binshui Xidao Extension 391, Tianjin, China; School of Electrical Engineering and Automation, Tianjin University of Technology Binshui Xidao Extension 391, Tianjin, China; School of Electrical Engineering and Automation, Tianjin University of Technology Binshui Xidao Extension 391, Tianjin, China; School of Electrical Engineering and Automation, Tianjin University of Technology Binshui Xidao Extension 391, Tianjin, China",2022 IEEE International Conference on Mechatronics and Automation (ICMA),"22 Aug 2022","2022","","","904","910","With the rapid development of photovoltaic, wind power and other new energy sources, more and more renewable energy sources have been applied to the power market. However, there is still a serious phenomenon of “abandoning light and wind” at the present stage. In Addition, China’s fossil energy still occupies a dominant position. Therefore, how to improve the utilization rate of renewable energy and reduce carbon emissions is a problem worthy of study. Based on micro the renewable energy power suppliers and power grid in the net in the thermal power suppliers as the research object, based on cooperative game model is established and the consensus league chain mechanism, combined with the carbon emission reduction contribution and load characteristics, set up power and new energy power plant net income for the biggest target of cooperative game model, and through the analysis of the trading main body’s contribution to the alliance, Improve Shapley value profit distribution model. Simulation results show that: based on the cooperative game formed by blockchain, the total profit of power suppliers is higher than the sum of the profits of power suppliers under the traditional mode, which improves the utilization rate of renewable energy, reduces the rate of abandoned light and wind, and reduces the carbon emissions.","2152-744X","978-1-6654-0853-0","10.1109/ICMA54519.2022.9856034","National Natural Science Foundation of China; ","https://ieeexplore.ieee.org/stamp/stamp.jsp?arnumber=9856034","mechanism of exchange;consensus mechanism;cooperative game","Renewable energy sources;Analytical models;Simulation;Games;Carbon dioxide;Wind power generation;Generators","","","","12","IEEE","22 Aug 2022","","","IEEE","IEEE Conferences"
"CO2 Footprint and Nodal Marginal Emission up to Distribution End Users for Energy Mix","A. Y. Saber; M. Ashraful Alam; T. Khandelwal","Optimization and AI Group, ETAP, Irvine, CA, USA; Optimization and AI Group, ETAP, Irvine, CA, USA; Optimization and AI Group, ETAP, Irvine, CA, USA",IEEE Access,"18 Jun 2024","2024","12","","83733","83739","To achieve the clean energy target set by various countries and states for 2030, it is crucial to assess Carbon Emission Flow (CEF) accurately across the entire energy supply chain. This paper introduces an innovative approach employing artificial intelligence (AI) techniques to calculate both direct (Scope 1) and indirect (Scope 2) CEF, encompassing power generation, transmission, and end-user consumption of radial and loop networks. While direct emissions from connected generators can be measured using power generation data, heat rates, and fuel types, indirect emissions from imported/exported power require AI algorithms analyzing historical and real-time data. CEF for a customer or any entity is the amount of CO2 generated from power sources for that customer or entity. Our methodology computes the total (both direct and indirect) and locational marginal emission (LME) for diverse energy mixes at each node and load in the power network. This approach provides precise location specific CEF data, allowing identification of nodes with varying carbon intensity. By understanding the emissions landscape, policymakers can develop targeted strategies, facilitating the reduction of carbon emissions and guiding future taxation policies. This innovative AI-driven framework enhances our ability to transition towards a sustainable energy future while meeting clean energy goals.","2169-3536","","10.1109/ACCESS.2024.3397675","California Energy Commission under CEC for project “Artificial Intelligence Based Heavy-Duty Fleet Charging to Enable Distributed Energy Resource Integration”(grant numbers:EPC-20-038); ","https://ieeexplore.ieee.org/stamp/stamp.jsp?arnumber=10529976","CO₂ flow;scope 1 and 2 emissions;heat rate;energy mix;distributed energy resources;locational marginal emission;data driven AI model;radial and loop networks","Carbon dioxide;Electricity;Generators;Pollution;Load flow;Artificial intelligence;Power generation;Carbon emissions;Renewable energy sources;Carbon tax","","","","23","CCBYNCND","13 May 2024","","","IEEE","IEEE Journals"
"Mid-long Term Interprovincial Renewable Energy Consumption Potential and Strategy of Clean Emission in Shanghai’s Power Sector","F. Ding; X. Li; B. Zhou; M. Wu; E. Gnansounoue","East China Branch of SGCC, Shanghai, China; East China Branch of SGCC, Shanghai, China; School of Electric Power Engineering, Shanghai University of Electric Power, Shanghai, China; East China Branch of SGCC, Shanghai, China; GPE- INTER – ENAC Ecole Polytechnique Fédérale de Lausanne, Lausanne, CH, Switzerland",2021 IEEE Sustainable Power and Energy Conference (iSPEC),"24 Mar 2022","2021","","","2275","2281","This paper proposes a system analysis approach on Shanghai’ s power supply system and carbon emission policy. Based on the prediction and assessment of a mid-long term development on power supply system from 2010 to 2030, by using Planelec-Pro, which is a least-cost probabilistic simulation and dynamic programming model,an evaluation of the CO2 emission reduction potential in terms of energy saving will be given. This study is also summarize the main factors affecting emissions of carbon dioxide gas in Shanghai,from the aspects of power system technology and policy mechanisms, to propose rationalization of technology strategy and policy improvements to promote the Inter-provincial Renewable Energy Consumption, which can be a reference and guidance for the Inter-provincial power trading to take proactive steps to combat climate change. his paper also discusses the role and role of East China Power Grid in China’s unified power market system, analyzes the positioning of East China Power Grid under the two-level power market system, and puts forward the construction path map of inter provincial power market of East China Power Grid under the unified power market system.","","978-1-6654-1439-5","10.1109/iSPEC53008.2021.9735490","","https://ieeexplore.ieee.org/stamp/stamp.jsp?arnumber=9735490","Clean Emission;Interprovincial Renewable Energy Consumption;low carbon;power supply;green house gas","Renewable energy sources;Thermal expansion;Carbon dioxide;Solar energy;Predictive models;Power markets;Power grids;Climate change","","","","20","IEEE","24 Mar 2022","","","IEEE","IEEE Conferences"
"Optimal Scheduling Strategy for Green Certificate-Incorporated Electricity Markets","X. Yuan; Q. An; Q. Xu; S. Qiao","School of Electrical & Electronic Engineering, North China Electric Power University, Beijing, China; School of Electrical & Electronic Engineering, North China Electric Power University, Beijing, China; Zhejiang Power Exchange Center, Hangzhou, China; Zhejiang Power Exchange Center, Hangzhou, China",2023 5th International Conference on Power and Energy Technology (ICPET),"29 Dec 2023","2023","","","1336","1341","With the proposal of the target for “emission peak” and “carbon neutrality”, the electricity-carbon market is deeply integrated. The construction of carbon market can promote the optimization of thermal power unit portfolio and effectively reduce the carbon emissions of power system. The existing literature has conducted a thorough study on the outgrowth technology of power systems under the electricity-carbon market. However, there is no research on the way of green power clearing in the electricity-carbon market. The optimal clearing of green power has a great impact on the electricity-carbon coupled market, which is conducive to promoting the consumption of renewable energy in the power system and reducing the carbon emission of the power system. In this paper, a joint market model of electricity and carbon is constructed by considering green power in market clearing, and the impact of different green power prices on the carbon emissions of the power system is simulated. A MATLAB-based national carbon emission calculation example verifies the effectiveness of the proposed method.","","979-8-3503-3967-3","10.1109/ICPET59380.2023.10367548","State Grid Corporation of China; ","https://ieeexplore.ieee.org/stamp/stamp.jsp?arnumber=10367548","electricity-carbon market;green power;market clearing;carbon emission","Renewable energy sources;Green products;Carbon dioxide;Optimal scheduling;Electricity supply industry;Mathematical models;Power markets","","1","","15","IEEE","29 Dec 2023","","","IEEE","IEEE Conferences"
